{
  "$schema": "https://json-schema.org/draft/2020-12/schema",
  "$id": "https://github.com/littletrojan/rebake-rules/schema/rule-pack.schema.json",
  "title": "Rebake Rule Pack",
  "description": "Schema for a single validation rule pack consumed by Rebake's IFC compliance validator.",
  "type": "object",
  "required": ["schema_version", "id", "version", "name"],
  "additionalProperties": false,
  "properties": {
    "schema_version": {
      "type": "integer",
      "const": 1,
      "description": "Pack-format schema version. v1 is the only supported value today; future revisions bump this and update the loader."
    },
    "id": {
      "type": "string",
      "pattern": "^[a-z0-9][a-z0-9-]*$",
      "description": "Stable machine identifier. Used in warning citations as `pack_id::rule_id`. Lowercase letters, digits, and hyphens only."
    },
    "version": {
      "type": "string",
      "pattern": "^\\d+\\.\\d+\\.\\d+$",
      "description": "Semver of this pack's content. Bump on any rule change so consumers can pin known-good versions."
    },
    "name": {
      "type": "string",
      "minLength": 1,
      "description": "Human-readable display name for Rebake's loaded-packs list."
    },
    "description": {
      "type": "string",
      "description": "Optional longer description of what this pack covers and why."
    },
    "category": {
      "type": "string",
      "pattern": "^[a-z][a-z0-9-]*$",
      "description": "Primary grouping axis for Rebake's validation panel. Every warning that rules in this pack fire inherits this category. Open vocabulary — common values: 'ifc', 'building-code', 'sustainability', 'structural', 'accessibility'. Missing or unspecified is legal for back-compat with v1.0 packs; consumers default to 'ifc' in that case."
    },
    "severity": {
      "type": "string",
      "enum": ["error", "warning", "info"],
      "description": "Pack-level default severity for every warning this pack's rules fire. Individual rules (e.g., allowlist rows) may override with their own `severity` field. Missing falls back to the engine default 'warning'. Use 'error' for hard-stop rules (permit blockers, code violations); 'warning' for soft issues; 'info' for advisory hints."
    },
    "allowlist": {
      "type": "array",
      "description": "One entry per element kind. Each entry says which IFC entity class strings are accepted on elements of that kind.",
      "items": {
        "type": "object",
        "required": ["applies_to", "allowed"],
        "additionalProperties": false,
        "properties": {
          "applies_to": {
            "type": "string",
            "enum": ["wall", "slab", "space", "opening", "level"],
            "description": "Rebake element kind this allowlist row governs."
          },
          "allowed": {
            "type": "array",
            "minItems": 1,
            "uniqueItems": true,
            "items": {
              "type": "string",
              "pattern": "^Ifc[A-Z][A-Za-z0-9]*$"
            },
            "description": "IFC 4.3 entity class names accepted for this element kind. Must start with `Ifc` followed by PascalCase."
          },
          "severity": {
            "type": "string",
            "enum": ["error", "warning", "info"],
            "description": "Per-row severity override. Takes precedence over the pack-level `severity`. Use when one element kind needs a stricter (or softer) level than the rest of the pack — e.g. a building-code pack that's mostly 'error' but softens space-class checks to 'warning'."
          }
        }
      }
    }
  }
}
